,index,종류별,상황별,재료별,방법별,제목,url,조회수,셰프,인분,조리시간,난이도,재료,인트로,조리순서,해시태그
242,9643,밑반찬,일상,과일류,절임,매실장아찌담은지 일년만에 꺼냈는데 꼬들꼬들 너무 맛있어요.,https://www.10000recipe.com/recipe/6854433,"15,612",로즈의 맛수다                                ,6,10분 이내,아무나,"['매실장아찌                                                                                    1컵', '고추장', '다진마늘', '생강술', '다진파', '참기름', '깨소금']","작년 6월 16일 홍쌍리 매실 장인의 방법으로 담아서 일 년을 뚜껑도 열지 않고

 김치냉장고에 넣어두었다가 며칠 전 조금 꺼내서 무쳐보았어요~~~

꺼내서 보니 위에 설탕 덮어둔 것도 조금은 녹지 않은 상태로 있고 

보기에도 싱싱해 보이더라고요~!!
컴퓨터가 씹는 소리까지 들을 수 있다면 좋겠어요~~~

어찌나 오도독하고 아삭한지 씹는 식감이 너무 좋아서 자꾸만 먹게 되네요~~~

씹을 때마다 아작아작 오도독 소리가 들릴 정도네요~~~

홍쌍리 매실 명인의 말대로 담아놓고 뚜껑도 열지 말고 그대로 두었다가

일 년쯤 두었다가 열어서 무쳐보면 그 맛에 반한다고 하더니 정말 저도 깜놀했답니다~~~","['볼에 고추장2큰술과 생강술1큰술 다진마늘큰술 참기름1큰술 깨소금1작은술을 넣어 잘 섞어 놓았어요~~~\n매실장아찌를 넣고 조물조물 무쳐주었어요~~~\n완성 접시에 담아준 다음 다진 파 조금 올려주고 통깨 솔솔 뿌려주면 끝이지요~~!\n(매실장아찌 담는법)\nhttp://blog.naver.com/wjdtj54/220392063297', '씹을수록 오도독하고 아삭한 매실장아찌\n요거 한 가지만 있음 찬밥 물에 말아 두 그릇도 눈 깜빡할 사이에 먹을 수 있을 것 같네요~~~\n여름에 김밥쌀때도 매실장아찌를 넣으면 식중독을 막아준다고 하지요~~~\n그만큼 매실은 소화작용에 도움을 주는 아주 좋은 식품이지요~~!\n올해는 장아찌도 매실 청도 안 담고 그냥 지나갔는데 \n작년에 담은 매실장아찌를 아껴서 내후년까지 먹어야 할 것 같지요~~~\n내년에 담아서 일 년을 두었다가 꺼내려면 2018년 여름이나 되어야 하잖아요~~~\n올해 몸 컨디션이 너무 안 좋아서 그냥 지나갔더니\n너무 오랜 시간 기다려야 하네요~~~', '요건 같은 장아찌 무침인데 사진이 거무스름하게 나왔네요~~~', '제가 담았지만 정말 많은 분들에게 맛 보여주고 싶은 맛이랍니다~~~\n오도독 아작아작 어쩜 이리도 꼬들꼬들할까요~~~', '제가 열 번 설명하는 것보다 한번 드셔봐야 그 맛을 알 텐데 조금 아쉽네요~~~\n여러분들도 내년에 매실장아찌 담는 법 참고하셔서 그대로 담아보세요~~~\n정말 해마다 담고 싶어질 테니까요~~~', '처음 꺼내서 항아리에 있던 것을 유리병으로 합해서 담아놓고 \n항아리에 남은 것 조금 꺼내서 무쳤어요~~~!\n매일 먹어도 싫증 나지 않을 것 같아요~~~', '해마다 담아놓은 매실청이나 매실장아찌는 우리 집 효자 반찬인 것 같아요\n가끔씩 먹고 싶을 때가 있을 때마다 꺼내면 입맛이 확 돌아오거든요~~~\n더운 여름 불앞에 서있지 않고 맛있는 반찬을 먹을 수 있답니다~~\n여러 이웃님들 이곳 경남 더워도 너무 더워요~~~\n비도 한 방울 오지 않아서 더 더운 것 같아요~~~']","['매실장아찌담는법', '매실장아찌 맛있게담는법', '매실장아찌무침']"
243,9644,밑반찬,일상,과일류,절임,감말랭이(곶감) 고추장 장아찌,https://www.10000recipe.com/recipe/6843456,"17,604",예쁜포비                                ,6,10분 이내,아무나,"['감말랭이                                                                                    1kg', '시판 고추장', '매실청', '국간장', '연두']","단맛도 나면서 매콤한 고추장과 짭짤한 간장이 밴 톡톡 튀는 밑반찬, 감말랭이(곶감) 고추장 장아찌랍니다.","['감말랭이를 준비해 주었습니다. 근데 감말랭이도 완전히 건조한 것이 있고, 반건조 느낌의 제품도 있더라고요. 완전히 건조된 것을 이용하시면 더 좋은 것 같습니다.', '감말랭이는 한 입 크기로 잘라 주었습니다.', '설거지 양을 줄이려면 감말랭이 고추장 장아찌를 보관할 밀폐용기에 시판 고추장, 국간장, 매실청, 연두를 넣고 잘 섞어 주세요. 그냥 집 고추장을 이용하시는 것보다 시판 고추장을 이용하시면 더 맛있어요. 이유야 주부라면 다들 아시겠지만 시판 고추장이 집 고추장보다 더 달고, 덜 짜고 감칠맛이 있기 때문입니다.', '자른 감말랭이를 넣고 골고루 무쳐 무쳐', '볼에 예쁘게 다시 한번 사진 찍어 주었네요. 감말랭이 고추장장아찌는 바로 드시기보다는 일주일 정도 냉장고에서 숙성 후 드시면 됩니다.', '식사하실 때 1-2씩 드시면 단맛도 나면서 매콤한 고추장과 짭짤한 간장이 밴 톡톡 튀는 밑반찬이 될 것입니다. 저도 이 반찬 배울 때 넘 맛이 좋아서 집에서 다시 만들어 보았네요. 물론 레시피는 살짝 다르지만. 집에 밑반찬이 있어야 식사 준비하는 것이 훨씬 수월해 집니다. 매번 끼니때마다 반찬 준비하려면 1-2시간은 주방에서 보내도 모자랄 판이지요. 요런 감말랭이 고추장 장아찌 같은 밑반찬 있으면 구색이 맞으니까요.']",
244,9645,밑반찬,일상,과일류,절임,꼬들꼬들 매실 장아찌 담그기,https://www.10000recipe.com/recipe/5012314,"25,859",이그림                                ,6,2시간 이상,초급,"['매실', '황설탕', '매실청']",매실 장아찌 수월하게 담는 법을 소개합니다.,"['깨끗이 씻은 매실은 소쿠리에 건져 바람 부는 곳에 두고 물기를 완전히 제거하고 작업합니다.', '방망이로 탁 내려치면 사방으로 갈라지고 씨를 분리됩니다.', '매실 장아찌 담글 때 매실원액(전에 만든 매실청)을 넣으면 발효를 활성화 시킬 수 있어요. 유리병에 매실 담고 매실청 1리터 붓고 섵탕을 1 : 1로 부어주세요. 맨위에 설탕을 부어 마무리 하고 면천으로 덮어주세요.', '닷새 정도 지난 매실은 파랗다가 이렇게 노오랗게 잘 숙성되어 건져주었습니다.', '완성된 매실장아찌는 고추장 약간 넣고 참기름만 넣어 조물조물 무쳐드세요.']",
245,9646,밑반찬,일상,과일류,절임,매실장아찌 ,https://www.10000recipe.com/recipe/6826589,"38,469",삐야기                                ,6,2시간 이상,초급,"['매실', '소금물', '설탕']",피로회복에 좋은 매실엑기스를 만들었어요.,"['두어번 정도 씻은 다음 소금을 넉넉히 풀어 소금물에 절여둘거에요.', '10시간이상 절이기', '소금물에 절인 매실을 체반에 받쳐 물기를 빼주고', '매실씨랑 과육 분리시키기. (소주병으로 내리치면 쉬워요)', '다시 한번 씻어서 물기를 빼고', '열탕 소독해주고', '씨를 뺀 과육이 3kg 조금 못되기에 설탕은 1.2kg만 준비했어요.', '잘 버무린다음 위에 올릴 설탕을 제외하고 나머지는 전부다 씨를 뺀 과육에 담아 버무려줍니다.', '병에 담고 설탕을 넣어줬어요.', '매실액기스 완성']","['피부미용', '피부탄력', '각질제거', '꿀피부', '아기피부', '윤기나는', '탄력있는', '동안', '촉촉한', '매실', '장아찌', '매실장아찌']"
246,9647,밑반찬,일상,과일류,절임,새콤한 매실장아찌,https://www.10000recipe.com/recipe/1963089,"16,772",sunny                                ,6,2시간 이상,아무나,"['매실과육만                                                                                    2.2kg', '설탕', '물', '소금']","새콤달콤, 아작거리니 아주 맛난 매실장아찌랍니다.","['매실을 씻어 물기는 좀 있어도 상관없답니다. 어차피 소금물에 절여야 하니까요. 씻어서 물기를 말린 매실은 꼭지를 크나 작으나, 이쑤시개로 이렇게 따 주세요.', '그 다음 매실의 과육을 칼로 도려내어 씨만 발려주세요.', '도려낸 매실은 소금물에 하룻밤 절궈놓습니다.', '다음날이 되면, 이렇게 올리브색으로 변해있지요? 체에 받쳐 물기를 제거하고 매실의 무게를 잽니다.', '매실무게의 70%정도의 설탕을 넣어 버무려 줍니다.', '이렇게 버무린 매실장아찌는 보관용기에 담아냉장고에 넣어주시면 된답니다. 여름에는 실온에 두면 곰팡이가 생기니 설탕농도를 100%로 넣지 않는 이상 냉장고에서 숙성시켜주세요. 3개월 후, 매실장아찌는 고추장에 버무려 드셔도 되구요. 그냥 드셔도 새콤달콤, 아작거리니 아주 맛나답니다.']",
247,9648,밑반찬,일상,과일류,절임,곶감 장아찌 만들기.. 남는 곶감으로 장아찌 만들어요.,https://www.10000recipe.com/recipe/6840866,"11,967",콩설기                                ,2,15분 이내,중급,"['곶감', '간장', '고추장 크게', '물엿 or 매실청', '청양고추', '깨', '참기름']",남은 곶감으로 만든 장아찌입니다.,"['곶감을 준비하고요.', '적당한 크기로 썰어주세요.', '간장3T, 고추장 크게 3T, 물엿이나 매실청 3T\n넣고 버무립니다.', '요렇게요. 언뜻보면 매실장아찌 같네요.', '청양 고추 다진것과 깨 그리고 참기름 넣고 조물조물 무쳐주세요.', '곶감 장아찌가 완성되었습니다.']","['곶감반찬', '곶감요리', '곶감장아찌']"
248,9649,밑반찬,일상,과일류,절임,참외 장아찌,https://www.10000recipe.com/recipe/6913000,"19,098",Anna의밥상                                ,5,90분 이내,초급,"['참외', '간장', '소주', '미림', '올리고당', '식초', '물']","냉장고에 시든 참외로 장아찌를 
만들었습니다","['위에 재료를 준비해 주세요', '참외를 깨끗이 씻어 주세요', '참외로 속을 제거하고 썰어 주세요', '3을 소금에 3 시간 절야 주세요', '참외가 잘절여 잤ㅂ니가', '5를 햇볕에 말려 주세여', '믕1캅', '식초 반컵', '소주 반컵', '간장반컵 올고당 반컵', '10을 침외에 부어 주세요', '11을 무거운것 으로 눌러 주세여', '12를 냉장고에 3일 보관합니다', '간장 따라서 끓여 식혀 다시부어 주세요']",
249,9650,밑반찬,일상,과일류,절임,청참외장아찌,https://www.10000recipe.com/recipe/6894211,"4,838",와니1009                                ,6,2시간 이상,고급,"['청외                                                                                    20개', '천일염']","예부터 선조들의 지혜가 엿보이는 담백한 본연의 맛을 내는 장아찌 입니다.
무침 김치 장아찌로 활용 합니다.","['베이킹소다로 청외를 흐르는 물에 깨끗이 씻는다.', '쓴맛이 나는 꼭지부분은 잘라내고, 숟가락 으로 씨부분을 파내고 김장봉투에 천일염 2컵으로 절여준다.', '파낸 씨부분은 효소와 함께 절여 다른 요리에 활용한다.', '10시간 정도 절여 김치냉장고에 보관한다.', '먹을때 마다 적당히 냉수에 간을 빼서 면보에 물기를 꼭짜서\n김치나 무침으로 활용하고 별다른 양념첨가 없이 담백한 맛을 원하시면 본연의 맛을 즐기시는 것도 좋다.']","['다이어트', '비만']"
250,9651,밑반찬,일상,과일류,절임,매실 장아찌 쉽게 담그는 법,https://www.10000recipe.com/recipe/6871569,"16,709",저녁노을                                ,6,120분 이내,초급,"['매실', '설탕', '소금']","언니네 텃밭 가장자리에 자라는 매실나무 올해도 제법 튼실하게 열었다. 해마다 열리는 녀석, 버릴 수는 없고 그냥 장아찌를 담갔다.","['1. 매실장아찌 만들기 : 매실은 흐르는 물에 깨끗하게 씻어 하룻밤 말려 물기를 제거해 두고 이쑤시개로 꼭지를 제거한다.', '매실 작두에 넣어 꾹 눌려 씨를 제거한다.', '저울에 매실을 달아본다.', '소금을 넣고 물기가 생기면 짜서 버리고, 설탕을 넣고 버무려 둔다.', '매실과 설탕물을 통에 담아둔다.', '나머지 남은 설탕으로 덮어준 후 3개월간 밖에서 숙성시킨 후 김치냉장고에 넣어둔다.', '2. 매실장아찌 무침 (재료) : 매실 장아찌 100g, 고춧가루 2숟가락, 깨소금, 참기름 약간', '매실장아찌와 진액을 꺼내둔다.', '매실 진액에 고춧가루, 깨소금, 참기름을 넣고 양념장을 만들어준다.', '잘 섞어주면 완성된다.']",
251,9652,밑반찬,일상,과일류,절임,사과를 반찬으로 사과약지 사과장아찌만들기,https://www.10000recipe.com/recipe/6873055,"3,587",불량엄마소자매마미                                ,6,2시간 이상,초급,"['사과말랭이 사과', '고춧가루', '고추장', '물엿', '액젓', '다진 마늘', '통깨']","안녕하세요~불량엄마 소자매마미예요. 아침에 먹는 사과는 금과라고 하죠^^ 소자매도 좋아하고, 몸에 좋다고 해서 집에 떨어뜨리지 않는 사과예요. 불량엄마는 가끔 박스째로 들여서 말랭이로 만들어 아이들 간식으로 주는데~ 사과 말랭이를 활용해 반찬도 만들 수 있다는 사실~! 새콤달콤 밑반찬으로 좋은 사과약지 만들어봤어요.","['사과는 껍질째로 식초물에 잘 닦아서 물기를 말린 후 슬라이스로 썰어 건조기에 70도로 6시간 말렸어요.', '너무 바짝 말린 말랭이는 물에 한번 헹궈 물기를 꼭 짜준 다음 말랑말랑 한 정도일 때 양념해주시면 돼요.', '양념장을 넣어 무쳐 주기만 하면 끝~!']","['초간단', '사과', '피로회복', '피부피용']"
252,9653,밑반찬,일상,과일류,절임,매실 장아찌 만들기,https://www.10000recipe.com/recipe/6829251,"9,077",피피꽁주                                ,6,2시간 이상,중급,"['청 매실', '설탕', '식초', '굵은소금', '소금']",한번 힘들면 입맛없을때 밥반찬으로 아주 좋은 매실장아찌 지금 해야해요!,"['일단, 청을 분리할때 번거롭고,\n미생물이 꼭지에 붙어있으면 매실청 고유의 맛에 영향을 줄수 있기에 매실은 꼭지를 모두 따주는 것이 좋아요!처음에는 이쑤시개로 따다가 안되겠다 싶어 바늘로 콕콕 이쑤시개보다 훨 잘 빠져요!', '매실장아찌용 매실에 간수 쫙 뺀 굵은소금 두 줌을 넣고 절여요!\n(매실 씨앗과 매실 과육이 잘 분리되도록 하는 효과를 주기 위한 과정이랍니다)', '절여진 매실은 흐르는 물에 두 번 씻은 뒤\n식초를 푼 물에 넣고 30분 정도 담가두었어요!', '식초물에 담갔던 청매실은 물기를 완전히 말려주세요.', '과도로 십자 모양을 최대한 길게 내주어요!', '그리고 방망이로 툭툭 내리쳐요.모양 비기 싫다고 칼로 자르기도 하던데,\n그러기에는 너무 힘들어요~\n(예쁘게 칼로 잘라서 하신분들 박수보내드립니다)', '요렇게만 벌어지면 얼마나 좋을까요?\n하지만 주변은 다 튀고, 제대로 안되는 것도 있고 시간 많이 걸립니다.\n아들이랑 둘이서 한 명은 십자 모양내고, 한 명은 방망이로 두들기고, 씨앗에 붙어서 안 떨어지는 매실은 칼로 도려내었어요.', '그리하야 매실 3kg 모두 씨앗과 분리했어요!\n씨앗 분리시킨 매실은 그냥 설탕에 절여도 되는데 이리 튀고 저리 튀고 아무래도 조금 꺼림칙한 것도 있고 좀 더 단단해지라고 굵은소금을 넣고 한 번 더 절였어요~', '굵은소금 두 줌을 뿌려 1시간 이상 절이니 이 정도의 수분이 빠져나왔네요~\n씨앗 뺀 매실 몇 kg 인지 알아랴 설탕를 계량하니 매실 무게를 재어봐야겠죠?! 매실 2kg 하고, 150g이네요!', '미리 소독해서 햇빛에 쨍~~말려두었던 유리병에 손질을 마친 매실을 넣고 설탕을 차곡차곡 넣어요!\n설탕이 한꺼번에 다 들어가진 않네요. 하지만 걱정하지 않아도 된답니다.']",
253,9654,밑반찬,일상,과일류,절임,청포도피클만들기,https://www.10000recipe.com/recipe/6831724,"4,144",시크릿로즈                                ,6,2시간 이상,초급,"['청포도알알이 뗀 것                                                                                    2컵', '소독한병', '피클링 스파이스', '물', '설탕', '식초', '소금']",살짝 아삭거리는 맛도 있고 상콤하니 이뿐 청포도피클 만들어 봅니다~,"['알알이 떼어 식초서너방울에 담갔다가 흐르는 물에 깨끗이 씻어두고 ~~ 씨없는 수입포도로 만들어야 아삭아삭 맛있는 피클이 됩니다~~', '피클만들기는 병소독이 젤루 중요하더라구요~~뜨거운 수증기 쐬어 병을 소독해 두고~~', '피클주스를 만들어줍니다~ \n피클링 스파이스1t 물,설탕,식초,소금 2 :1 :1:1 에 넣고 끓입니다~ \n푸르르 끓을때 레몬즙을 2t스푼 넣거나 생레몬 한조각 넣어주면 좋아요~ 더 달콤하길원하면 설탕한스푼 조금더 추가하시고 맛보았을때 새콤달콤하면 됩니다~~', '소독된 병에 포도를 담고 피클주스를 가득 부어 준 다음~~잠시 상온에서 식힌다음 냉장고속으로~~\n2-3일 숙성시킨 다음 바로 드시면 됩니다~']",
254,9655,밑반찬,일상,과일류,절임,아기메론피클,https://www.10000recipe.com/recipe/6895780,"1,528",콩설기                                ,6,2시간 이상,아무나,"['손질한 아기메론                                                                                    2kg', '물', '설탕', '식초', '소금', '피클링스파이스', '월계수잎']",상큼하고 달콤새콤 고급진 메론요리 아기메론피클 만들어 봅시다.,"['아기메론을 깨끗이 씻어 물기를 쫙 빼 주세요. 무농약이라 빡빡 씻을필요는 없어요.', '메론의 위 아랫부분을 살짝 잘라내고 반으로 잘라 주세요.', '숟가락을 이용해 속을 파내 주세요.', '먹기 좋은 크기로 얇게 썰어주세요.', '냄비에 피클물을 만들어요. 물6컵, 설탕2컵, 식초4컵, 소금2T, 피클링스파이스1T, 월계수잎 두어장을 넣고 끓여줍니다.', '열탕한 유리용기에 손질한 아기메론을 넣고 팔팔 끓인 피클물을 넣어주세요.\n이때 피클링스파이스가 들어가지 않게 체에 받쳐 넣어주세요.', '이제 며칠 기다렸다가 먹으면되요..^^', '상큼한 냄새 좋다 좋아. 이틀쯤 지나고 식촛물을 따라내어 다시한번 끓여 부어주었어요.']","['아기메론', '메론요리', '메론피클', '멜론요리', '아기멜론', '피클만들기', '피클레시피']"
255,9656,밑반찬,일상,과일류,절임,참외장아찌,https://www.10000recipe.com/recipe/6852224,"14,451",왕눈이2                                ,6,2시간 이상,초급,"['참외 큰거', '소금', '설탕', '현미식초', '매실청', '간장', '월계수잎']",맛이 없는 참외는 무우보다 맛이없지요~ 이럴땐 장아찌를 담아보세요~ 여름철 입맛없을때~맛나지요~,"['베이킹소다와 식초를 섞어서 잘세척해주세요~', '반으로 잘라서 속을 깨끗이 제거해주세요~', '소금으로 3시간에서 4시간정도 절궈주세요~~ 반으로 접어보려고 할때 부러지지 않을 정도면 됩니다~', '절군참외는 물에행궈서 키친타월로 물기를 제거후 햇볕에 하루동안 말려주세요~ 여름철엔 반나절 정도여도 될듯하네요~', '간장~식초~설탕 1:1:1 비율로 섞어서 부어주세요~~ (전 매실청을 좀 넣어주었답니다) 월계수잎은 없으시면 생략해도 되십니다~', '하루동안 상온에서 보관했다가 국물만 다시 따라내어서 끓인후 식은다음 다시부어주세요~ 그리고 냉장고에 일주일에서 열흘정도 보관했다가 꺼내서 드시면 돼요~ 그냥 드셔도 돼고~ 꼭짜서 양념해서 무쳐드셔도 맛나요~~']",
256,9657,밑반찬,일상,과일류,절임,메론장아찌 ,https://www.10000recipe.com/recipe/6952724,"1,197",버섯과동거                                ,6,2시간 이상,초급,"['메론', '소금', '설탕', '식초']","솎아낸 아기메론을 친구가 한자루 가져왔어요.
여름에 입맛 살리기 좋은 오독오독 식감이 좋아요
밥도둑이예요.","['아기메론을 반으로 자른다음 숟가락으로 속을 파낸다.', '속을 파낸 모습입니다.', '파낸 메론을 물로 깨끗이 씻어줍니다.\n물기를 빼기위해서 소쿠리에 담아놓습니다.', '먹기 좋은 크기로 썰어서 식픔건조기에\n말립니다.', '한판 말렸는데 줄어서 한줌 밖에 안되네요', '말린 메론을 소금,설탕,식초를 적당한 비율로 ( 1:1: 0.5) 끓여 줍니다.\n끓여준 소스를 담겨진 메론위에 부어줍니다.', '저는 5개월정도 지나서야 생각나서 \n꺼내봤어요.\n꼬들거리면서 식감이 오독독하네요', '물기를 꼭 짜서 고추가루,마늘, 매실청약간,참깨,참기름 넣고 무쳤어요.\n새콤달콤 오독독 씹는 식감이 아주 맛나고 좋아요. 밥도둑이네요.']","['메론', '밥도둑', '장아찌']"
257,9658,밑반찬,일상,과일류,절임,이보카도장,https://www.10000recipe.com/recipe/6985563,178,lemonsatelier                                ,4,10분 이내,아무나,"['아보카도', '방울토마토', '양파', '간장', '물', '설탕', '레몬즙 또는 식초']","요즘은 별걸 다 장을 만들어요.
게장..새우장..처럼 이번엔 아보카도장.
미국에 살고있는 딸들이 강추해서 만들어봤더니 맛있네요.","['초간단 재료들....\n청양고추 한개 넣어주면 칼칼하답니다.\n저희는 칼칼 좋아하지 않아서 안 넣었어요.', '방토는 칼집을 내주고....\n양파는 굵게 채썰고....', '아보카도는 좀 단단한것으로 준비해서 썰고싶은대로 썰고....\n깍뚝썰기? 편썰기? 다 괜찮아요', '저는 편썰기했어요\n그런데 나중에 먹어보니 깍뚝 썰기가 강장이 덜 스며들어 좋은 듯 싶어요.', '용기에 준비한 재료 다~~ 넣고 간장소스 부어 주기.', '맛있어져라~~~ 주문 외우고 냉장고에서 하루 숙성 후 먹으면 돼요', '먹을 때는 큰 그릇에 밥을 담고...\n그 위에 아보카 도장을 얹고 달걀 반숙 프라이 올리고 참기름과 통깨 톡톡', '방토가 예상외로 맛 있었고\n양파 씹히는 맛도 좋았고\n아보카도 전혀 느끼하지 않아요.']","['아보카도장', '아보카도', '초스피드요리', '쉬운요리', '특별식']"
