,index,종류별,상황별,재료별,방법별,제목,url,조회수,셰프,인분,조리시간,난이도,재료,인트로,조리순서,해시태그
0,9401,밑반찬,일상,버섯류,튀김,새송이버섯강정 만드는 법,https://www.10000recipe.com/recipe/4158610,"34,154",풀향기                                ,,,,"['새송이버섯', '슬라이스아몬드', '녹말가루', '식용유', '고추장', '진간장', '매실액', '올리고당', '맛술', '다진마늘']",매콤달콤 쫄깃쫄깃한 반찬! 새송이버섯강정,"['새송이버섯은 적당한 크기로 썰어줍니다.', '1회용 비닐봉지에 썰어 놓은 새송이버섯을 담고 녹말가루를 넣어 튀김옷을 입혀줍니다. 비닐봉지를 이용하면 가루가 손에 묻지 않아서 좋답니다.', '달군 프라이팬에 식용유를 적당량 붓고 170도씨 온도에서 튀김옷을 입힌 새송이버섯을 넣어 노릇노릇하게 튀겨냅니다.', '달군 프라이팬에 분량의 양념 재료 고추장, 진간장, 매실액, 올리고당, 맛술, 다진 마늘을 넣고 보글보글 끓여줍니다.', '튀겨낸 새송이버섯과 슬라이스아몬드를 넣고 버무리듯 양념을 고루 묻혀 주고 불에서 내려요. 새송이버섯강정 만드는 거 어렵지 않지요.', '흐르는 물에 깨끗하게 씻어서 물기를 제거한 깻잎 한 장을 접시에 깔고 새송이버섯강정을 담아냅니다.']",
1,9402,밑반찬,일상,버섯류,튀김,표고버섯강정 ,https://www.10000recipe.com/recipe/4251762,"13,016",풀향기                                ,3,30분 이내,초급,"['표고버섯', '찹쌀가루', '녹말가루', '아몬드가루', '식용유', '고추장', '진간장', '매실액', '올리고당', '맛술', '다진마늘']","표고버섯 요리로는 표고버섯 밥, 표고버섯 전, 표고버섯탕수, 표고버섯볶음 등 다양한데요. 향긋한 표고버섯으로 강정을 만들어 보려고 합니다. 씹는 맛이 일품인 향긋한 표고버섯강정 소개합니다.","['표고버섯은 끓는 물에 살짝 데친 후 찬물에 헹구어 기둥과 물기를 제거하고 먹기 좋은 크기로 썰어줍니다.', '1회용 비닐봉지에 썰어 놓은 표고버섯을 담고 찹쌀가루와 녹말가루를 넣어 튀김옷을 입혀줍니다.', '달군 프라이팬에 식용유를 적당량 붓고 170도씨 온도에서 튀김옷을 입힌 표고버섯을 넣고 노릇노릇하게 튀겨줍니다.', '달군 프라이팬에 분량의 양념 재료 고추장, 진간장, 매실액, 올리고당, 맛술, 다진 마늘을 넣고 보글보글 끓여줍니다.', '튀겨낸 표고버섯을 넣고 버무리듯 양념을 고루 묻혀주고 불에서 내려요.', '표고버섯강정을 접시에 담고 고명으로 아몬드가루를 살짝 뿌려냅니다.']",
2,9403,밑반찬,일상,버섯류,튀김,새송이 버섯요리 / 새송이버섯 튀김 ,https://www.10000recipe.com/recipe/6926774,"4,465",요알남Mingstar                                ,1,10분 이내,아무나,"['새송이버섯', '튀김가루', '물', '식용유']","새송이버섯을 이용하여 다양하고 맛있는 반찬을 만들어 보세요.
새송이버섯은 자연산 송이버섯을 대체하기 위해 재배되어 나온 것입니다. 비타민 C가 풍부합니다. 05:06초 부터 보세요.","['버섯은 씻어 적당한 크기로 자른다.', '튀김가루, 물을 넣고 반죽을 만든다.', '새송이버섯에 튀김 반죽을 입혀준다.', '프라이팬에 식용유를 넣고 튀겨 준다.']","['새송이버섯', '새송이버섯요리', '새송이버섯반찬', '새송이버섯튀김', '새송이버섯레시피', '버섯튀김', '버섯요리', '버섯반찬', '버섯레시피']"
3,9404,밑반찬,일상,버섯류,튀김,‘새송이&만가닥&갈색팽이’ 버섯튀김 만드는 방법!!바삭바삭한 튀김 만드는 방법~!!,https://www.10000recipe.com/recipe/6969877,334,판교맘’s누구나집밥                                ,4,60분 이내,초급,"['새송이버섯', '만가닥버섯', '갈색 팽이버섯', '전분가루', '소금']",남은 버섯을 활용해 ‘버섯튀김’을 해 보았아요^^,"['새송이버섯 3개를 반으로 잘라주시고,', '+로 칼집을 아래 1cm정도 남기고 내 주셔요.', '만가닥버섯100g, 갈색팽이버섯100g,', '새송이버섯 사이에 소금 살짝 뿌려 30분간 절여주시고,', '키친타월로 물기를 제거해 주신 후,', '전분가루를 사이사이 고르게 묻혀주시고,', '기름 넉넉히 둘러,', '노릇하고 바삭한 느낌이 들 때까지 튀긴 다음,강불', '튀김트레이에 잠시 두었다가,', '‘어린잎채소-버섯튀김-홍고추’를 얹어 마무리하였습니다.', '오늘도 맛나게드셔요~~^^']","['발암억제효과', '다이어트', '버섯튀김']"
4,9405,밑반찬,일상,버섯류,튀김,고추소스 동그랑땡 표고 강정,https://www.10000recipe.com/recipe/6849184,"1,114",CJ 제일제당                                ,2,30분 이내,고급,"['해바라기씨유', '비비고도톰동그랑땡                                                                                    10 개', '건표고버섯', '마늘즙', '전분', '청양고추', '홍고추', '양파', '대파(흰부분)', '간장', '백설스위트리자일로스설탕', '백설식초                                                                                    2 큰술', '청주']",명절 지내고 나면 꼭 남는 동그랑땡. 이제는 냉동실에 넣지 말고 색다른 요리로 만들어 보자. 튀긴표고와 함께 매콤한 맛이 일품인 고추소스에 버무리면 느끼함이 싹 가신 새로운 요리가 된다. 명절 때 동그랑땡을 넉넉히 해두면 그때그때 별미로 즐길 수 있는 레시피다.,"['표고버섯은 물에 불려 기둥을 제거하고 먹기 좋게 2~4등분한다. 분량의 고추소스 재료는 고루 섞는다.', '달군 팬에 백설 해바라기유를 두르고 비비고 도톰 동그랑땡을 앞뒤로 노릇하게 굽는다.', '표고버섯은 마늘즙을 넣어 고루 버무린 후 전분을 뿌려 고루 섞는다. 냄비에 백설 해바라기유를 넣고 175℃까지 가열하여 표고버섯을 넣고 노릇하게 튀긴 후 체에 밭친다.', '냄비에 고추 소스를 넣고 한 소끔 끓여 여기에 동그랑땡과 표고버섯을 넣고 고루 버무린다.', '접시에 담아 완성한다.']",
5,9406,밑반찬,일상,버섯류,튀김,"3색 모둠 느타리버섯(백선, 순정, 곤지7호) 바삭! 버섯치킨",https://www.10000recipe.com/recipe/6964900,161,돌돌언니                                ,3,60분 이내,초급,"['3색 모둠 느타리버섯', '치킨튀김가루', '위트빅스                                                                                    5조각', '간장', '고추장', '물엿', '설탕', '다진마늘', '케첩']","저희 집은 종종 양송이와 표고버섯으로 치킨을 만들어 먹는데요, 오늘은 평소랑 다르게 느타리를 살짝 뭉쳐서 더 비슷한 느낌을 내 보았어요. 느타리 고유의 식감과 바삭함이 더해져서 아주 맛있답니다. ^^","['버섯을 가볍게 씻은 뒤, 취향에 맞게 가르고 물 반 컵, 치킨튀김가루를 넣고 잘 섞어 줍니다.', '그 다음에 누룽지 또는 위트빅스를 손으로 잘게 부순 후에 반죽과 섞어 줘요.', '중불로 예열한 기름에 빠르게 튀겨 줍니다.', '튀긴 버섯은 건져서 키친타올 위에 올려 기름기를 제거해요.', '다른 팬에 물 3T 넣고 준비한 양념 소스를 넣어 줍니다.', '어느 정도 졸았으면 식혀 줘요.', '버섯을 접시에 담은 뒤, 약간 식힌 소스를 부으면 완성입니다. ^^ 저는 땅콩이랑 통깨를 뿌렸어요.']","['3색모둠버섯', '백선순정곤지7호', '비건', '버섯', '느타리', '버섯치킨']"
6,9407,밑반찬,일상,버섯류,굽기,버섯으로 관자 느낌 내는 방법! 새송이버섯간장버터구이 만들기,https://www.10000recipe.com/recipe/6912734,"282,932",루던                                ,1,15분 이내,아무나,"['새송이버섯', '버터', '어린잎채소', '간장', '맛술', '올리고당']",지금까지 이런 버섯은 없었다. 이것은 관자인가 버섯인가,"['버섯의 밑동과 갓을 잘라낸 뒤, 3~4등분 한다', '자른버섯의 양면에 칼집을 낸다', '팬에 버터를 녹인다', '버섯을 굽는다', '불을 약불로 줄이고 소스를 넣고 졸인다']","['버섯', '새송이버섯', '버터']"
7,9408,밑반찬,일상,버섯류,굽기,새송이버섯요리,https://www.10000recipe.com/recipe/6914931,"58,293",시크제이맘                                ,2,60분 이내,아무나,"['새송이버섯', '식용유', '통깨', '고추장', '고춧가루', '간장', '맛술', '다진 마늘', '올리고당', '참기름']",버섯요리,"['새송이버섯은 길게 모양을 살려 썰어 주세요.', '볼에 양념재료인 고추장 1, 고춧가루 1, 간장 1, 맛술 1, 다진 마늘 0.5, 올리고 당 2, 참기름 1을\n한데 섞어 새송이버섯 구이 양념장을 만들어 주세요.', '달군 팬에 식용유를 적당하게 두르고', '앞, 뒤로 노릇하게 구워 주세요.', '버섯이 구워지면 만들어 놓은 양념장을 펴 바르고\n앞, 뒤로 살짝 더 구워 마무리합니다.\n새송이버섯을 미리 구워주어 오랫동안 구울 필요가 없어요.\n양념을 바르고 구우면 탈수 있으니 살짝만 구워 주세요.', '새송이버섯 구이 완성 ^^']","['새송이버섯구이', '버섯요리']"
8,9409,밑반찬,일상,버섯류,굽기,팽이버섯구이 팽이버섯 제발 이렇게 드세요 왜냐하면....,https://www.10000recipe.com/recipe/6992655,332,즐거운날랄라                                ,3,10분 이내,아무나,"['팽이버섯', '쪽파 또는 부추', '홍고추', '간장', '참치액젓', '맛술', '들기름', '올리고당', '고춧가루', '통깨', '다진마늘']","체지방 감소, 면역력강화에 도움을 주는
팽이버섯을 기름없이 살짝 구워 먹었더니... 

기름으로 인한 느끼함 없이 깔끔하게 
먹을 수 있어 너무 맛있어요~ 

오독오독한 식감에 짭조름한 양념장이
더해지니 팽이버섯 1~2개는 
그자리에서 호로록록~ 
팽이버섯 맛있게 만들어 보세요","['팽이버섯은 밑둥을 제거하고 \n이물질들을 털어내어 제거합니다팽이버섯은 물에 담가 세척하면 수용성 영양분이\n쉽게 빠져나간다고 하니 이물질을 털어내거나 빠르게 세척합니다', '가로로 넓직하게 썰어주세요', '홍고추 1개, 부추 나 쪽파 1/2대 총총 잘게 썰어주세요', '분량의 양념장을 \n모두 넣어 잘 섞어주세요간장 3큰술, 참치액젓 1큰술 맛술 1큰술, 들기름 2큰술 올리고당 2큰술, 고춧가루 1큰술 통깨 1큰술, 다진마늘 1/2큰술쪽파나 부추는 듬뿍 (1/2줌) 넣어 줘야지 \n간이 적당하게 맞아 더 맛있게 드실 수 있어용~', '마른팬에(기름X) 팽이버섯을\n앞, 뒤로 중불에서 구워줍니다', '노릇하게 잘 익은 팽이버섯에\n양념장을 적당히 뿌려주면 완성입니다']","['팽이버섯', '팽이버섯구이', '팽이버섯레시피', '팽이버섯양념장', '팽이버섯요리']"
9,9410,밑반찬,일상,버섯류,굽기,새송이버섯구이 레시피,https://www.10000recipe.com/recipe/6992595,100,고구미                                ,1,10분 이내,아무나,"['새송이버섯', '올리브유', '소금', '후추']","드디어 나도 해먹어본 통새송이버섯구이 ‼️‼️‼️
sns에서 지이이인짜 많이 본 에어프라이기로 하는 통새송이버섯구이 레시핀
저장만 해두다가 드디어 해먹어봄!!
이 맛있는 버섯구이를 귀찮아서 이제야 해먹어본 나 반성해..","['통새송이버섯구이 재료는 뭐 없죠..진짜 새송이버섯만 있으면 되니께여', '올리브유 조금 바르고 소금 후추 3-4꼬집 뿌려서\n에어프라이기에 190도 10분 (5분마다 앞뒤로 뒤집어주기)\n돌려주면 끝인데\n이 간단한걸 나 왜 이제 해먹은겨,,,\n에어프라이기 제품사양마다 시간은 달라질수 있으니 참고!!에어프라이어', '5분 됐을때 열었더니 이정도!\n앞뒤로 돌려서 5분 한번 더~!!', '완성', '크ㅠㅠㅠㅠ아니 여러분 여기 버섯즙보세여,,\n진짜 촉촉,,!! 버섯국물이 흘러넘친다구여', '간 조금 더해먹고싶어서 후추소금 조금 더 뿌리고\n내 최애만능양념 와사비까지', '이렇게 콕 와사비 얹어먹으면 진짜 도라방스 맛~~~\n쫄깃쫄깃해여 버섯이']","['버섯요리', '새송이버섯구이', '새송이버섯에어프라이기', '에어프라이기요리', '다이어트요리', '버섯구이레시피', '새송이버섯레시피', '통새송이버섯구이']"
10,9411,밑반찬,일상,버섯류,굽기,냉장고에 새송이 하나쯤은 있쟈냐~! 새송이간장버터구이 ★,https://www.10000recipe.com/recipe/6919453,"49,557",만개의레시피                                ,2,20분 이내,아무나,"['새송이버섯', '꽈리고추', '버터', '통깨', '간장', '맛술', '올리고당', '후추']","굴러다니던 재료의 변신은 끝이없지~! 
이렇게 만드니 버섯인줄 아무도 몰라!!!
세상의 모든 레시피 만개의레시피","['새송이버섯은 양쪽을 잘라낸 후 3등분 한다.남은 버섯은 찌개 끓이거나 볶음밥 재료에 사용해요.', '통썰기 한 버섯 윗면에 칼집을 낸다.', '볼에 양념 재료를 넣고 양념장을 만든다.', '달군 팬에 버터를 녹인 후 새송이버섯을 앞뒤로 굽는다.                    \n\n                            네오플램 피카 프라이팬', '꽈리고추와 양념장을 넣고 조린 뒤 통깨를 뿌려 완성한다.']","['버섯', '버섯레시피', '새송이버섯', '새송이간장버터구이', '단짠', '반찬', '간단 반찬', '버섯버터구이']"
11,9412,밑반찬,일상,버섯류,굽기,느타리버섯양념구이,https://www.10000recipe.com/recipe/4042421,"46,353",풀향기                                ,3,30분 이내,초급,"['느타리버섯', '실파', '통깨', '식용유', '고추장', '고춧가루', '진간장', '맛술', '올리고당', '다진 파', '다진 마늘', '참기름']",느타리버섯과 갖은 양념으로 만든 매콤하고 쫄깃쫄깃한 반찬! 느타리버섯양념구이 소개합니다.,"['느타리버섯은 끓는 물에 살짝 데친 후 찬물에 헹구어 물기를 제거해 줍니다. 굵은 느타리버섯은 반으로 찢어 주었어요.', '분량의 양념 재료 고추장, 고춧가루, 진간장, 올리고당, 맛술, 다진 파, 다진 마늘, 참기름을 넣어 양념을 만들어줍니다.', '느타리버섯에 양념을 넣어 버무린 후 재워둡니다.', '달군 프라이팬에 식용유를 두르고 구워줍니다. \n느타리버섯은 끓는 물에 데친거라 오랫동안 굽지 않아도 된답니다.']",
12,9413,밑반찬,일상,버섯류,굽기,[식약처] 양송이구이,https://www.10000recipe.com/recipe/6992353,129,식품의약품안전처                                ,1,60분 이내,중급,"['양송이', '로즈마리', '돼지고기 다짐육', '청양고추', '후추', '다진마늘', '달걀', '밀가루', '홀스레디쉬                                                                                    30g', '레몬즙', '후추']",삼삼한 밥상 조리법을 소개합니다.,"['양송이는 꼭지를 제거하고 밀가루를 살짝 \n묻혀준다.', '청양고추를 송송 다진다.', '청양고추, 다진 돼지고기, 계란을 함께 버무려\n준다.', '양송이 소에 양념된 돼지고기를 채워준다.', '소스를 만들어준다.', '팬에 양송이를 구워준 후 로즈마리를 올려주고 \n소스와 함께 낸다.']","['청양고추와', '마늘을', '사용해', '특유의', '맛과', '향을', '냈고', '양송이버섯', '특유의', '감칠맛으로', '나트륨', '사용을', '줄일', '수가', '있다.', '식품의약품안전처', '마이나슈', '삼삼한밥상4권']"
13,9414,밑반찬,일상,버섯류,굽기,양송이 속을 돼지고기로 채워 만든 에어프라이어 양송이버섯구이 ★ ,https://www.10000recipe.com/recipe/6929703,"21,166",만개의레시피                                ,4,60분 이내,초급,"['양송이버섯', '다진돼지고기', '빵가루', '베이컨', '식용유', '굴소스', '맛술', '설탕', '다진마늘', '소금', '후추']","에어프라이어 쉽게 간단한 일품요리 만들기! 
버섯구이인지 완자구이인지 모를 만큼 고기 듬뿍 채워 
양송이버섯을 더 맛있게 먹는 법! 
세상의 모든 레시피 만개의레시피","['양송이버섯은 기둥을 제거하고 베이컨은 다진다.제거한 버섯 기둥은 다져 주세요.', '다진 돼지고기에 베이컨, 버섯기둥, 양념재료를 넣어 섞는다.', '양송이버섯에 고기를 동그랗게 모양 잡아 올리고 빵가루를 묻힌다.', '에어프라이어 바스켓에 버섯을 넣고 식용유를 뿌린 후 180도 온도에서 30분간 구워 완성한다.에어프라이어']","['에어프라이어', '버섯구이', '돼지고기버섯구이', '에어프라이어 버섯구이', '양송이버섯구이', '에어프라이어 튀김', '간단', '에어프라이어 간단한 레시피']"
14,9415,밑반찬,일상,버섯류,굽기,새송이관자 버터양념구이 생일생신상요리,https://www.10000recipe.com/recipe/6992161,152,햇살머금은집                                ,2,10분 이내,아무나,"['새송이버섯', '버터', '물', '간장', '설탕', '고춧가루', '통깨', '대파']",새송이버섯 에어프라이어 양념구이 만들어 볼께요.,"['고기식감이 나는 맛있는 새송이버섯 양념구이 만들어 볼께요.', '적당한 크기로 새송이 버섯을 잘라서 윗부분 2/3에 칼집을 넣어 주세요.', '버터를 윗부분에 발라 주세요. 에어프라이어에 넣고 180도 5분 돌려 주세요.에어프라이어', '물2T.간장2T.설탕1/2t.고춧가루1t.통깨약간.대파약간을 넣고\n잘 섞어서 양념장을 만들어 주세요.그리고 에어프라이어에 넣고\n180도 3분 돌려 주세요.', '그럼 양념 새송이버서구이 에어프라이어로 뚝딱 완성이랍니다.']","['에어프라이어요리', '에어프라이어', '새송이버섯구이', '새송이버섯굽기', '양념', '새송이버섯', '양념구이만들기', '에어프라이어요리추천', '손님초대음식', '집들이음식', '생신상차림메뉴']"
15,9416,밑반찬,일상,버섯류,굽기,간단한 밑반찬 새송이버섯 고추장구이 만드는 법,https://www.10000recipe.com/recipe/6900918,"38,845",뽕림이                                ,2,15분 이내,아무나,"['새송이버섯', '쪽파', '통깨', '고추장', '고춧가루', '진간장', '올리고당', '다진 마늘', '물', '참기름']","오늘은 향긋한 새송이버섯을 이용해 간단한 밑반찬 하나를 만들어보았어요.

바로 쫄깃쫄깃 매콤한 새송이버섯 고추장구이되시겠슴당 :)","['새송이버섯은 0.5cm 두께로 잘라주세요.', '쪽파는 송송 썰어주세요.', '고추장 2.5T, 고춧가루 1/2T, 진간장 1T, 올리고당 1T, 다진 마늘 1/3T, 물 3T, 참기름 1T을 넣고 잘 섞어 양념장을 만들어요.', '예열한 팬에 새송이버섯을 앞뒤로 가볍게 구워줍니다.\n* 숨이 약간 죽을 정도면 돼요 :)', '구운 버섯에 양념장을 골고루 발라준 뒤 약불에서 졸이듯 구워주세요.', '완성된 새송이버섯 고추장구이를 접시에 담고 통깨를 샤샥 ~ \n송송 썬 쪽파도 적당량 올려 마무리합니다.', '매콤하고 쫄깃한 새송이버섯 고추장구이가 완성되었어요 :)']","['다이어트', '새송이버섯', '새송이버섯구이', '새송이버섯고추장구이', '별미반찬', '인기메뉴', '버섯요리', '간단한밑반찬', '밑반찬']"
16,9417,밑반찬,일상,버섯류,굽기,식감도 향도 모두 잡은~‘새송이버섯고추장구이’만드는 방법~!!양념장 황금레시피^^,https://www.10000recipe.com/recipe/6972062,"5,894",판교맘’s누구나집밥                                ,3,20분 이내,초급,"['새송이버섯', '다진파', '깨', '고추장', '고춧가루', '올리고당', '진간장', '다진마늘', '들기름', '물', '깨', '생강가루', '매실액']",식감도 향도 좋은 ‘새송이고추장구이’입니다~,"['새송이3개는 편으로 잘라 마른팬에 구워주시고,', '굽는 동안 양념장을 준비하겠습니다. 고추장2T,', '고춧가루1T,', '올리고당1T,', '간장1T,', '다진마늘1/2T,', '들기름1T,', '물2T,', '생강가루1/2t,', '깨1/2T,', '매실액1T를 고르게 섞어주신 후,', '달궈진 팬에 붓고, 바글바글 끌어오르면,', '구운 버섯을 구워주셔요.중불', '양념장이 다 졸아들때까지 펼쳐서 구워주시면 됩니다.', '가지런히 담아 대파와 깨를 함께 올려 마무리 하였습니다.', '오늘도 맛나게 드셔요^^']","['새송이버섯고추장구이', '버섯구이', '새송이버섯구이', '버섯요리', '버섯반찬']"
17,9418,밑반찬,일상,버섯류,굽기,새송이 버섯구이 ,https://www.10000recipe.com/recipe/6697217,"65,692",MJ후다닥레시피                                ,2,30분 이내,초급,"['새송이버섯', '고추장', '고춧가루', '물엿', '간장', '다진마늘', '참기름', '다진파', '물', '통깨']",매콤하니 오독오독 매력적인 고추장소스 새송이버섯구이입니다.,"['먼저 새송이버섯은 편으로 썰어주세요. 수분이 빠지면 얇아지니까 너무 얇게는 썰지마시고요.', '분량의 양념을 넣어 섞어주세요.', '새송이버섯의 수분도 빼줄 겸 말랑해지가 앞뒤로 한번 씩 구워 숨을 죽여주시고요.', '고추장양념을 넣어 새송이버섯을 졸이듯 팬에 구워주시면 됩니다.']",
18,9419,밑반찬,일상,버섯류,굽기,새송이버섯구이 만드는 법,https://www.10000recipe.com/recipe/6561166,"176,786",짜옹                                ,3,15분 이내,아무나,"['새송이버섯', '다진파', '버터', '간장', '다진마늘', '올리고당', '참기름']",슬라이스 버섯에 맛있는 양념이 베인~ 영양만점 요리 새송이버섯구이를 만들어볼게요~,"['버섯은 이렇게 슬라이스 해서 잘라주세요. 너무 얇지 않게 0.5cm 정도 두께로 잘라주면 적당한거같아요.', '양념장을 만들어 주었답니다. 간장 3, 다진마늘, 올리고당, 참기름 1 넣었어요.', '팬에 버터를 녹여주었습니다. 잘라주었던 버섯을 구워주세요. 앞뒤로 노릇하게 구워주시면 됩니다.', '불을 줄이고 양념을 적당히 올려서 양념이 골고루 묻도록 구워주세요. 주의하실점은 불을 너무 쎄게 하면 양념이 많이 탈수 있으니 불을 중불로해서 양념을 조려주세요. \n마지막에 다진파를 올려서 데코를 해주면 완성입니다!']",
19,9420,밑반찬,일상,버섯류,굽기,10분완성 ～표고버섯 버터구이 ~~또 먹고싶은 버터간장맛☆☆☆☆☆,https://www.10000recipe.com/recipe/6965464,"4,111",키친JY                                ,3,10분 이내,아무나,"['표고버섯', '대파', '버터', '식용유', '술(15ml)', '물(30ml)', '간장 작은큰술(5ml)', '황설탕 (5ml)', '다진마늘', '후추']","표고버섯이 많아서 생각하게된 요리입니다~ 
간편하고 손쉬운 버터구이~
버터.간장.대파향.마늘향 ~발란스 맞춘 버터구이 
맛잇엇답니다~~^___^
(식감이 쫄깃쫄깃하니 넘 맛잇엇어요)","['표고버섯 중앙에 칼집을 내어주세요 \n대파는 쫑쫑 썰어주세요.', '약불로하고 팬에 버터와 기름을 넣고 버섯올리고 중불로 온도올려 \n중약불로 하고 1분정도 굽고, 뒤집어 중약불에 1분구워내 그릇에 담아내어 주세요.', '후라이팬 그대로 대파와 소스넣고 강불로 한번 끓어올리고 버섯도올려 중약불로 하고 천천히 맛이 들어가게끔 \n조림구이 해갑니다.', '다되면 실파.통깨 조금 올리면 \n더욱 먹음직스럽습니다 ☆']","['표고버섯', '버터구이', '면연력증강']"
20,9421,밑반찬,일상,버섯류,굽기,"매콤 달콤한 팽이버섯 양념구이.(버섯요리, 밥반찬, 채식.)",https://www.10000recipe.com/recipe/6959723,"12,227",시골할매                                ,3,10분 이내,아무나,"['팽이버섯', '통깨', '참기름', '진간장', '고추장', '고춧가루', '굴소스', '올리고당', '설탕', '맛술', '후추', '다진마늘']",묶음으로 팔아서 팽이버섯을 어쩔 수 많이 구매 했을 때 한 번에 맛있게 해결하기 위해 만들어 본 메뉴인데 밥 반찬으로 딱 이더라고요~그래서 레시피를 공유해봅니다^^,"['양념을 비율대로 골고루 섞어둔다.', '밑둥을 자르고 결대로 찢은 팽이버섯을 마른 팬에 깔아준다.', '기름이 없이 노르스름하게 수분을 말리듯이 굽는다.(수분이 남으면 양념을 발랐을때 물기가 생겨서 안됩니다.)', '약간의 색이 나면 가스불을 끄고 양념을 발라 준 뒤 다시 가스불 약불에서 살짝만 더 굽는다.', '참기름과 통깨를 뿌려 주면 완성된다.']","['홈쿡', '밥반찬', '집밥', '한식', '팽이버섯', '버섯구이', '양념구이', '건강식', '채식반찬', '초스피드', '초간단', '매운버섯']"
