,index,종류별,상황별,재료별,방법별,제목,url,조회수,셰프,인분,조리시간,난이도,재료,인트로,조리순서,해시태그
78,9479,밑반찬,일상,버섯류,굽기,팽이버섯구이 팽이버섯 제발 이렇게 드세요 왜냐하면....,https://www.10000recipe.com/recipe/6992655,333,즐거운날랄라                                ,3,10분 이내,아무나,"['팽이버섯', '쪽파 또는 부추', '홍고추', '간장', '참치액젓', '맛술', '들기름', '올리고당', '고춧가루', '통깨', '다진마늘']","체지방 감소, 면역력강화에 도움을 주는
팽이버섯을 기름없이 살짝 구워 먹었더니... 

기름으로 인한 느끼함 없이 깔끔하게 
먹을 수 있어 너무 맛있어요~ 

오독오독한 식감에 짭조름한 양념장이
더해지니 팽이버섯 1~2개는 
그자리에서 호로록록~ 
팽이버섯 맛있게 만들어 보세요","['팽이버섯은 밑둥을 제거하고 \n이물질들을 털어내어 제거합니다팽이버섯은 물에 담가 세척하면 수용성 영양분이\n쉽게 빠져나간다고 하니 이물질을 털어내거나 빠르게 세척합니다', '가로로 넓직하게 썰어주세요', '홍고추 1개, 부추 나 쪽파 1/2대 총총 잘게 썰어주세요', '분량의 양념장을 \n모두 넣어 잘 섞어주세요간장 3큰술, 참치액젓 1큰술 맛술 1큰술, 들기름 2큰술 올리고당 2큰술, 고춧가루 1큰술 통깨 1큰술, 다진마늘 1/2큰술쪽파나 부추는 듬뿍 (1/2줌) 넣어 줘야지 \n간이 적당하게 맞아 더 맛있게 드실 수 있어용~', '마른팬에(기름X) 팽이버섯을\n앞, 뒤로 중불에서 구워줍니다', '노릇하게 잘 익은 팽이버섯에\n양념장을 적당히 뿌려주면 완성입니다']","['팽이버섯', '팽이버섯구이', '팽이버섯레시피', '팽이버섯양념장', '팽이버섯요리']"
79,9480,밑반찬,일상,버섯류,굽기,새송이버섯 들기름 간장구이 ,https://www.10000recipe.com/recipe/6944546,"1,141",좋아좋아3                                ,3,10분 이내,아무나,"['새송이버섯', '들기름', '소금', '간장', '생수', '맛술', '마늘', '모닝고추', '올리고당']","마트가면 꼭 챙겨오는 버섯

그 중에서도 새송이버섯은 늘 챙겨오는 편인데요

활용도가 높아서 애정하는 버섯 입니다 ㅎ

​

오늘은 들기름에 구워 볼텐데요

간장소스로 맛 내기도 합니다","['새송이버섯은\n길이로 4~5등분 해 줍니다\n두툼한 아이는 5조각\n좀 작은 아이는 4조각 내 주면 됩니다', '들기름 두르고\n새송이버섯 올려 구워 줍니다\n그릴팬 사용했어요\n그릴선이 들어가면 더 맛나 보이니까~~ ㅎㅎ\n구울때 소금 살짝 뿌려요', '마늘은 입자있게 다지고\n고추는 씨 털고 마늘크기로 썰었어요\n소스재료 모두 담고\n소스 만들어요', '팬에 소스재료 담고\n잠시 끓여요', '버섯 담고\n간장 끼얹으며 살짝 조려 줍니다\n들기름 톡~~\n마무리해요']","['구이', '버섯', '새송이버섯', '새송이버섯간장구이', '새송이버섯들기름간장구이', '건강한반찬']"
80,9481,밑반찬,일상,버섯류,굽기,새송이버섯 마늘 버터구이 이제 이렇게 요리 하세요,https://www.10000recipe.com/recipe/6969449,"1,373",켕이의식탁                                ,1,15분 이내,아무나,"['새송이버섯', '청양고추', '다진마늘', '버터', '간장', '굴소스', '올리고당']",새송이버섯 길게 자르지말고 동글동글한 단면으로 칼집넣어 잘라 요리해보세요. 버섯채즙을 안에 듬뿍 머금은 관자느낌의 새송이버섯 매력에 빠지게 될겁니다.,"['새송이버섯은 밑둥을 자르고 약 2~3센티 정도의 두께로 단면을 잘라주세요.새송이버섯 1봉(약 4개)칼, 도마', '자른 새송이버섯 단면에 양념이 잘 베일 수 있도록 사진처럼 칼집을 내어주세요.', '청양고추는 잘게 다지듯이 작게 잘라줍니다. 매운맛을 좋아하지 않는다면 쪽파 등으로 대체해주세요.청양고추 2개(쪽파 대체가능)', '재료손질이 끝나면 버터 약 1스푼을 팬에 넣고 약불에서 녹여줍니다.버터 1스푼프라이팬약불', '버터가 녹으면 step2에서 손질한 새송이버섯을 넣고 구워주세요step2의 재료중불 이하', '새송이버섯 하나씩 뒤집어가며 반대방향도 구워줍니다. 버섯이 익으니까 칼집넣은 삿갓부분이 정말 이쁘네요.', '새송이버섯을 한쪽으로 밀어내고 버터 1스푼과 다진마늘 약 2스푼을 넣어 볶아주세요.버터 1스푼, 다진마늘 2스푼주걱', '마늘향이 올라오기 시작하면 새송이버섯과 마늘을 섞듯이 골고루 볶아줍니다.', '팬 한귀퉁이에서 간장 1/2스푼, 굴소스 1스푼, 올리고당 1스푼을 넣고 양념만 살짝 끓인 뒤에 새송이버섯과 섞으면서 볶아주세요.간장 1/2스푼, 굴소스 1스푼, 올리고당 1스푼', '마지막으로 step3에서 다진 청양고추를 넣어 볶아주면 완성입니다.step3의 재료', '관자 요리 느낌나는 새송이버터구이, 칼집 사이사이로 버터향과 양념이 잘 배여 정말 맛있습니다.', '밑반찬으로 먹기도 좋고 술안주로도 정말 좋아요. 저렴한 새송이버섯 집에 사놓은게 있으시다면 이렇게 요리해보세요^^']","['새송이버섯', '초간단', '술안주', '반찬']"
81,9482,밑반찬,일상,버섯류,굽기,팽이버섯구이,https://www.10000recipe.com/recipe/6959205,"1,649",바다빈                                ,1,5분 이내,아무나,"['팽이버섯', '파슬리가루', '들기름', '버터', '후추', '깨']",자취생 간편하게 한끼 반찬 만들기,"['팽이버섯과 버터를 준비해주세요', '버터를 티수푼 1T정도 넣고 녹여주세요', '밑둥을 자른 씻지 않은 버섯을 분해해서 넣어주세요', '들기름을 넣어주세요', '후추를 약간 뿌려주시고 소금은 입맛따라 넣어주세요 (소금 생략가능)', '3분간 앞뒤로 뒤집어 주세요\n저는 깨와 파슬리가루로 마무리했네요\n완성^^']","['자취생', '한끼반찬', '초간단', '초재료']"
82,9483,밑반찬,일상,버섯류,굽기,새송이 버섯 버터구이 만들기,https://www.10000recipe.com/recipe/6964665,"1,189",츄츄맘                                ,1,15분 이내,아무나,"['새송이버섯', '버터', '진간장', '맛술', '올리고당', '참기름', '다진파', '다진 마늘', '물']","버섯은 건강에도 좋고 찌개, 탕, 볶음류에도 다양하게 쓰이는 재료이지요? 그래서 버섯은 냉장고에 거의 빠지지 않고 채워져 있는데요 이렇다 할 반찬거리가 없어서 새송이버섯을 꺼내 양념을 하고 버터로 구워서 반찬을 해 먹어봤어요","['새송이버섯은 본인이 먹기 좋게 또는 접시에 올려놓기 좋게 썰어주세요. 두께는 약 1cm에서 1.5cm가 적당한 것 같더라구요. 취향에 따라 더 두껍게 해도 상관은 없어요', '양념은 다진파 1큰술, 다진마늘 1/2큰술, 진간장 1큰술을 넣어주세요', '올리고당 1/2큰술, 맛술 1큰술, 참기름 1/2큰술 추가로 물 3큰술 넣어 잘 섞어 양념을 준비해주세요', '먹기 좋게 썰어놓은 새송이버섯은 팬 위에 올려놓고 버터 1큰술을 나누어서 중간중간에 올려 버섯에 버터향이 밸 수 있도록 해줍니다', '앞뒤를 노릇노릇하게 잘 구워주세요. 버섯이 앞뒤로 잘 익으면 미리 만들었던 양념장을 약불에 졸여줍니다', '양념이 자작하게 졸아들면 접시에 올려 놓고 마지막으로 깨소금으로 마무리해주면 끝입니다']",
83,9484,밑반찬,일상,버섯류,굽기,"새송이버섯구이 만들기 어버이날 음식, 버터랑 간장으로 풍미있게 만들어요 :) ",https://www.10000recipe.com/recipe/6932830,"2,359",승혜의야미로그                                ,2,20분 이내,초급,"['새송이버섯 큰 거', '간장', '올리고당', '참기름', '다진 마늘', '소금', '버터', '다진 파']","저는 버섯은 전부 다 좋아하는데요! 
그중 새송이버섯을 제일 좋아해요 ^^ 
새송이버섯은 아무 양념 없이 
그냥 구워 먹기만 해도 맛있지만, 
버터랑 간장이랑 양념해서 먹으면 
더더더 맛있답니다~ 
버터랑 간장이랑 양념한 새송이버섯구이 만들기 ♥ 
우리 함께 노릇노릇 구워보아요 :)","['새송이버섯구이, 새송이버터구이를 만들기 위해 \n필요한 재료들을 먼저 알려드릴게요!새송이버섯 큰 거 4개, 간장 3큰술, 올리고당 2큰술, 참기름 1큰술, 다진 마늘 1.5티스푼, 소금 약간, 버터 한 덩이, 다진 파 적당량', '새송이버터구이, 새송이버섯구이를 만들기 위해 \n새송이버섯 큰 거 4개를 준비해주세요. \n토실토실하니 새송이버섯들이 귀엽네요ㅋ', '준비된 새송이버섯 4개는 \n찬물에 깨끗하게 씻어줍니다.', '찬물에 깨끗하게 씻어준 새송이버섯 4개는 \n너무 얇지 않은 두께로 잘라주세요. \n새송이버섯은 제 눈에 뭔가 귀엽게 생긴 것 같을까요..\nㅋㅋㅋ', '새송이버섯구이를 만들 때 새송이버섯의 두께는 \n이 정도의 두께도 썰어주세요~ \n새송이버섯을 너무 얇게 썰면 \n새송이버섯구이를 먹을 때 \n새송이버섯만의 매력적인 식감이 떨어져요~ \n딱! 요 정도의 두께로 새송이버섯을 썰어주시면 \n더욱 매력적인 새송이버섯구이를 맛보실 수 있습니당', '새송이버섯의 손질은 준비되었으니 \n이번에는 새송이버섯구이를 만들 때 \n새송이버섯에게 발라줄 양념장을 만들어보도록 할게요~ \n먼저 간장 3큰술을 그릇에 담아주세요.', '그리고 고소한 새송이버섯구이의 맛을 내기 위해 \n참기름 1큰술을 넣어주세요.', '달콤달콤한 올리고당 2큰술도 넣어줍니다.', '양념장을 만들 때 다진 마늘은 필수죠!!! ^_^ \n다진 마늘 1.5티스푼도 넣어주시구요~', '새송이버섯구이 양념장의 밑간을 위해 \n소금도 아주 약~간 넣어주세요.', '숟가락으로 모든 양념재료들을 골고루 섞어주시면 \n새송이버섯구이 양념장 완성이예요 ^^ \n참 쉽죠잉???ㅋㅋㅋㅋㅋ', '이제 새송이버섯들을 맛있게 구워줄게요. \n가스레인지나 인덕션 위에 프라이팬을 올려주세요.', '가스불은 중간불로 켜주세요. \n그리고 프라이팬에 버터 한 덩이를 올려 녹여줍니다.', '버터가 슬슬 녹기 시작하면 \n버터를 프라이팬에 골고루 둘러주세요.', '버터가 어느 정도 녹았으면 \n슬라이스해 준 새송이버섯들을 프라이팬에 \n차곡차곡 올려주세요. \n버터의 고소한 냄새가 너무 좋아요~~~', '새송이버섯을 앞뒤로 뒤집어가며 \n새송이버섯에 버터가 충분히 흡수되도록 구워주세용 \n나머지 새송이버섯들도 같은 방법으로 \n버터에 고소하게 구워줍니당', '1차로 새송이버섯들을 \n버터에 고소하게 구워주었어요~ \n버터에만 구운 새송이버섯을 먹어도 맛있지만 \n여기에 아까 만든 새송이버섯 양념장을 발라서 \n2차로 구워주면 더더 맛있지요 ^_^', '아까 새송이버섯들을 버터에 구웠을 때 사용한 \n프라이팬을 그대로 사용하시면 돼요~ \n가스레인지나 인덕션의 가스불을 \n마찬가지로 중간불로 켜주세요. \n달궈진 프라이팬에 1차로 버터에 구워준 \n새송이버섯들을 착착착 올려줍니다.', '그리고 새송이버섯 위에 아까 만들어놓은 \n새송이버섯 양념장을 발라주세요.', '새송이버섯을 뒤집어서 양념장을 한 번 더 발라준 뒤 \n노릇노릇하게 새송이버섯을 구워주세용', '그릇에 간장양념장까지 발라 노릇노릇하게 구워준 \n새송이버섯들을 가지런하게 올려주세요. \n새송이버섯들이 딱! 적당하게, 노릇하게 \n잘 구워져서 뿌듯했어요 *^^* \n꺄아아아아', '노릇하게 잘 구워진 새송이버섯 위에 \n초록초록한 다진 파들을 올려주면 \n더욱 먹음직스러운 새송이버섯구이가 완성됩니당 \n초록초록한 다진 파의 색감이 \n노릇노릇한 새송이버섯과 잘 어울려요~', '버터랑 간장으로 구운 \n새송이버섯구이 하나만 있으면 \n밥 한 그릇은 진짜 뚝딱일 것 같아요 ^^ \n물론 새송이버섯구이는 \n그냥 먹어도 맛있고, \n술안주로 먹어도 좋아요~ \n새송이버섯을 버터로 1차로 굽고, \n2차로 간장 양념장으로 구워서 \n정말 너무너무 맛있더라구요~ \n이거이거 완전 밥도둑 반찬이예요ㅋㅋ\n새송이버섯의 \n쫄깃하게 씹히는 식감도 좋아서 \n아이들도 좋아할 것 같아요.']","['승혜의야미로그', '꿈은이루어진다', '감사합니다', '고맙습니다', '반찬', '밑반찬', '새송이구이', '새송이버섯구이', '새송이버터구이', '버섯반찬']"
84,9485,밑반찬,일상,버섯류,굽기,쫄깃쫄깃~간단하고 맛있는 머쉬마루버섯 구이,https://www.10000recipe.com/recipe/6933326,545,머쉬마루                                ,2,5분 이내,아무나,"['머쉬마루 버섯', '꽃소금', '식용유']","초간단요리로 쫄깃하고 소금만 넣어도 맛있는 머쉬마루버섯 구이~
버섯 싫어하는 아이들도 너무 좋아하는 버섯이고 버섯,소금,식용유만 있으면되요~","['머쉬마루버섯은 반으로 잘라주세요', '달군팬에 기름두르고 머쉬마루버섯\n올려준후 꽃소금 약간만 뿌려주세요센불로 식용유 여유있게 넣어야 맛있어요~^^', '노릇노릇 익으면 앞뒤로 뒤집어가며 구워주세요', '쫄깃쫄깃 ~고기같은 식감 초간단 \n소금만 넣어도 뚝~딱 맛있는 머쉬마루버섯구이\n재료도 간단하고 밥반찬으로 너무 맛있어요^^']",['머쉬마루버섯머쉬마루버섯구이쫄깃쫄깃식감대박밥반찬아이들도 좋아하는버섯']
85,9486,밑반찬,일상,버섯류,굽기,도담레시피 만능고추장 응용 고추장 새송이구이 밑반찬 !,https://www.10000recipe.com/recipe/6927573,"1,443",도담레시피                                ,2,5분 이내,아무나,"['새송이버섯', '만능고추장                                                                                    1/2종이컵']","오늘은 #만능고추장 응용한 아주 간단한 고추장 새송이구이를 해볼텐데요.
만능고추장을 만들어놓고, 제육볶음이나 오징어볶음 등
볶음요리에도 잘어울리면서 간단한 진미채볶음이나 새송이구이 등등 밑반찬 만들기에도 굉장히 요긴하게 사용이 된답니다.

@6927242 
만능고추장 만드는 방법은 여기서 확인해주세요 :)","['1. 팬에 기름을 두르지 않고, 그대로 예열해주세요.', '2. 예열된 팬에 1cm 두께의 새송이버섯을\n잘 깔아주세요.', '3. 버섯이 노릇노릇해질때까지\n앞뒤로 뒤집어서 잘 구워주세요 ~', '4. 새송이 버섯에서 수분이 생기면\n만능고추장 1/2컵을 넣어주세요 ~', '5. 양념장에 새송이 버섯에 잘 배도록\n뒤집어가면서 양념이 타지 않도록 잘 뒤집어 주세요.', '6. 5분이내로 간단하게 만들수 있는\n고추장 새송이 구이 완성입니다!\n마무리로 통깨와 대파 쫑쫑 썰어서\n올려주시면 더 근사한 밑반찬이 완성되겠죠~']","['도담레시피', '도담반찬집', '5분밑반찬', '버섯요리', '대구반찬배달', '고추장새송이구이', '만능양념장', '만능고추장', '만능양념장만들기', '버섯밑반찬']"
86,9487,밑반찬,일상,버섯류,굽기,팽이버섯구이,https://www.10000recipe.com/recipe/6959205,"1,649",바다빈                                ,1,5분 이내,아무나,"['팽이버섯', '파슬리가루', '들기름', '버터', '후추', '깨']",자취생 간편하게 한끼 반찬 만들기,"['팽이버섯과 버터를 준비해주세요', '버터를 티수푼 1T정도 넣고 녹여주세요', '밑둥을 자른 씻지 않은 버섯을 분해해서 넣어주세요', '들기름을 넣어주세요', '후추를 약간 뿌려주시고 소금은 입맛따라 넣어주세요 (소금 생략가능)', '3분간 앞뒤로 뒤집어 주세요\n저는 깨와 파슬리가루로 마무리했네요\n완성^^']","['자취생', '한끼반찬', '초간단', '초재료']"
87,9488,밑반찬,일상,버섯류,굽기,새송이 버섯 버터구이 만들기,https://www.10000recipe.com/recipe/6964665,"1,189",츄츄맘                                ,1,15분 이내,아무나,"['새송이버섯', '버터', '진간장', '맛술', '올리고당', '참기름', '다진파', '다진 마늘', '물']","버섯은 건강에도 좋고 찌개, 탕, 볶음류에도 다양하게 쓰이는 재료이지요? 그래서 버섯은 냉장고에 거의 빠지지 않고 채워져 있는데요 이렇다 할 반찬거리가 없어서 새송이버섯을 꺼내 양념을 하고 버터로 구워서 반찬을 해 먹어봤어요","['새송이버섯은 본인이 먹기 좋게 또는 접시에 올려놓기 좋게 썰어주세요. 두께는 약 1cm에서 1.5cm가 적당한 것 같더라구요. 취향에 따라 더 두껍게 해도 상관은 없어요', '양념은 다진파 1큰술, 다진마늘 1/2큰술, 진간장 1큰술을 넣어주세요', '올리고당 1/2큰술, 맛술 1큰술, 참기름 1/2큰술 추가로 물 3큰술 넣어 잘 섞어 양념을 준비해주세요', '먹기 좋게 썰어놓은 새송이버섯은 팬 위에 올려놓고 버터 1큰술을 나누어서 중간중간에 올려 버섯에 버터향이 밸 수 있도록 해줍니다', '앞뒤를 노릇노릇하게 잘 구워주세요. 버섯이 앞뒤로 잘 익으면 미리 만들었던 양념장을 약불에 졸여줍니다', '양념이 자작하게 졸아들면 접시에 올려 놓고 마지막으로 깨소금으로 마무리해주면 끝입니다']",
88,9489,밑반찬,일상,버섯류,굽기,새송이버섯 마늘 버터구이 이제 이렇게 요리 하세요,https://www.10000recipe.com/recipe/6969449,"1,373",켕이의식탁                                ,1,15분 이내,아무나,"['새송이버섯', '청양고추', '다진마늘', '버터', '간장', '굴소스', '올리고당']",새송이버섯 길게 자르지말고 동글동글한 단면으로 칼집넣어 잘라 요리해보세요. 버섯채즙을 안에 듬뿍 머금은 관자느낌의 새송이버섯 매력에 빠지게 될겁니다.,"['새송이버섯은 밑둥을 자르고 약 2~3센티 정도의 두께로 단면을 잘라주세요.새송이버섯 1봉(약 4개)칼, 도마', '자른 새송이버섯 단면에 양념이 잘 베일 수 있도록 사진처럼 칼집을 내어주세요.', '청양고추는 잘게 다지듯이 작게 잘라줍니다. 매운맛을 좋아하지 않는다면 쪽파 등으로 대체해주세요.청양고추 2개(쪽파 대체가능)', '재료손질이 끝나면 버터 약 1스푼을 팬에 넣고 약불에서 녹여줍니다.버터 1스푼프라이팬약불', '버터가 녹으면 step2에서 손질한 새송이버섯을 넣고 구워주세요step2의 재료중불 이하', '새송이버섯 하나씩 뒤집어가며 반대방향도 구워줍니다. 버섯이 익으니까 칼집넣은 삿갓부분이 정말 이쁘네요.', '새송이버섯을 한쪽으로 밀어내고 버터 1스푼과 다진마늘 약 2스푼을 넣어 볶아주세요.버터 1스푼, 다진마늘 2스푼주걱', '마늘향이 올라오기 시작하면 새송이버섯과 마늘을 섞듯이 골고루 볶아줍니다.', '팬 한귀퉁이에서 간장 1/2스푼, 굴소스 1스푼, 올리고당 1스푼을 넣고 양념만 살짝 끓인 뒤에 새송이버섯과 섞으면서 볶아주세요.간장 1/2스푼, 굴소스 1스푼, 올리고당 1스푼', '마지막으로 step3에서 다진 청양고추를 넣어 볶아주면 완성입니다.step3의 재료', '관자 요리 느낌나는 새송이버터구이, 칼집 사이사이로 버터향과 양념이 잘 배여 정말 맛있습니다.', '밑반찬으로 먹기도 좋고 술안주로도 정말 좋아요. 저렴한 새송이버섯 집에 사놓은게 있으시다면 이렇게 요리해보세요^^']","['새송이버섯', '초간단', '술안주', '반찬']"
89,9490,밑반찬,일상,버섯류,굽기,초간단 새송이버섯간장버터구이 만들기,https://www.10000recipe.com/recipe/6982314,490,판교맘’s누구나집밥                                ,1,10분 이내,초급,"['새송이버섯', '버터', '깻잎', '간장', '맛술', '올리고당']",관자같은 식감의 쫄깃쫄깃 ‘새송이버섯구이’입니다.,"['새송이버섯을 도톰하게 잘라 양면에 칼집을 냅니다.', '간장1T, 맛술2T, 올리고당1/2T로 양념장을 준비!', '버터도 잘라 주시구요,', '달궈진 팬에 녹여주셔요.', '버터가 녹으면, 버섯을 노릇노릇하게 구워주시고,', '양념장을 붓고 졸여줍니다.중약불', '깻잎 올려 마무리하였습니다~오늘도 맛나게 드셔요^^']","['버섯요리', '새송이버섯', '버터구이', '새송이간장버터구이']"
90,9491,밑반찬,일상,버섯류,굽기,새송이버섯 요리 새송이버섯 강정 만들기 with 매콤한 간장소스,https://www.10000recipe.com/recipe/6982460,328,sta                                ,3,30분 이내,아무나,"['새송이버섯', '양상추', '건고추', '양파', '대파', '통마늘', '찹쌀가루', '전분가루', '진간장', '올리고당', '참기름', '포도씨유']","새송이버섯~
가격도 저렴하고 건강에도 좋은 식재료이지요~
새송이버섯 강정~ 맛도 좋고 건강에도 좋은 요리입니다.","['새송이 버섯은 뿌리 부분을 제거하고 약 2cm 길이로 잘라 주세요.\n자른 새송이버섯은 아랫부분을 남겨 두고 칼집을 넣어 주세요.', '칼집을 넣은 새송이버섯은 끓는 물에 데쳐 주세요.\n데친 새송이버섯은 찬물에 헹군 후 꽉~~\n짜서 물기를 짜 주세요.', '찹쌀가루와 전분가루를 섞어 주세요.전분 가루만 사용하셔도 좋지만 찹쌀 가루를 섞으면 바삭 쫄깃한 식감이 나서 좋아요.', '준비한 새송이버섯은 찹쌀 가루와 전분 가루를 입혀 주세요.', '가루를 입힌 새송이버섯은 오븐 팬에 포도씨유를 조금 넣고 올려 주세요.\n200도 오븐에서 구워 주세요.\n중간 중간 꺼내어 뒤집어 가면서 구워 주시면 좋아요.\n시간은 오븐에 따라 조절하시면 좋아요.오븐마지막에 오븐 온도를 조금 올려 바삭하게 구워 주시면 좋아요~', '새송이버섯이 오븐에 구워 지는 동안 강정 소스를 만들어 주세요.\n프라이팬에 마늘과 건고추를 볶다가 양파와 대파를 넣고 볶아 주세요.\n진간장과 올리고당을 넣어 졸여 주세요.기호에 따라 토마토 케찹이나 설탕을 넣으셔 좋아요.', '오븐에 구운 새송이버섯은 강정 소스에 넣어 버무려 주세요.\n마지막에 참기름을 넣어 주시면 강정이 윤기도 나고 참기름 향이 좋은 맛있는 강정이 됩니다.']","['새송이버섯요리', '새송이버섯강정', '다이어트요리', '건강한집밥요리', '버섯요리']"
91,9492,밑반찬,일상,버섯류,굽기,새송이버섯 버터구이 간단반찬 굿!!,https://www.10000recipe.com/recipe/6990684,396,좋아좋아3                                ,2,10분 이내,아무나,"['새송이버섯', '소금', '간장', '매실청', '생강청', '술', '다진마늘', '버터', '식용유']","간단반찬으로도 좋고

간단 술안주로도 좋은

새송이버섯 버터구이 입니다","['새송이버섯은 \n기둥이 오동통하니 굵은 것이\n사용해보니 좋네요\n끝 부분 자르고\n갓 부분도 자를게요\n자른 갓 부분은\n된장찌개 끓일때 사용해요', '5~6등분 해 주니 \n딱 좋네요\n칼집 넣어 주는데요\n끝까지 자르지 않도록 주의하며\n칼집 넣어요\n생략해도 되지만\n소금 한 꼬집 뿌려 두어요', '식용유, 버터넣고\n버터녹으면 버섯올려 구워 줍니다\n뒤집으며\n노릇노릇하게 구워요', '만들어둔 양념넣고\n뒤집으며\n소스 졸아들도록 조림 합니다', '맛있는 냄새 솔솔~~ ㅎ\n완성 입니다']","['새송이버섯', '배송이버섯버터구이', '술안주', '간단반찬']"
92,9493,밑반찬,일상,버섯류,굽기,[1인 가구 요리] 에어프라이어로 10분만에 만드는 통새송이 버섯구이,https://www.10000recipe.com/recipe/6991684,142,검멍이                                ,1,30분 이내,아무나,"['새송이버섯', '후추', '소금', '올리브유']","혼자살고 있는 빵순이입니다.
1인 가구가 먹기에 적당한 양과 만들기 간편한 방법을 소개합니다.","['새송이버섯의 아래단을 정리하고 씻겨줍니다.', '에어프라이어에 새송이버섯을 넣고, 후추와 소금을 마구 뿌려줍니다. 앞뒤로 골고루 생각보다 많이 뿌려주세요. 그리고 올리브유를 3스푼 넣어줍니다.', '에어프라이어 190도에 10분간 돌리면 완성입니다.에어프라이어']","['새송이버섯', '버섯요리', '버섯구이', '새송이버섯구이', '새송이버섯요리', '야식', '버섯']"
